--
-- XC_PREPARED_XACTS
--
-- Test to make sure prepared transactions are working as expected
-- If a transcation is preared and contains only a select, it should NOT be preapred on data nodes
-- create some tables
create table t1(val int, val2 int) DISTRIBUTE BY REPLICATION;
create table t2(val int, val2 int) DISTRIBUTE BY REPLICATION;
create table t3(val int, val2 int) DISTRIBUTE BY REPLICATION;
create table p1(a int, b int) DISTRIBUTE BY REPLICATION;
create table c1(d int, e int) inherits (p1) DISTRIBUTE BY REPLICATION;
WARNING:  Inherited/partition tables inherit distribution from the parent
DETAIL:  Explicitly specified distribution will be ignored
-- insert some rows in them
insert into t1 values(1,11),(2,11);
insert into t2 values(3,11),(4,11);
insert into t3 values(5,11),(6,11);
insert into p1 values(55,66),(77,88);
insert into c1 values(111,222,333,444),(123,345,567,789);
-- ****  
begin;
  select * from t1 order by val;
 val | val2 
-----+------
   1 |   11
   2 |   11
(2 rows)

  select * from t2 order by val;
 val | val2 
-----+------
   3 |   11
   4 |   11
(2 rows)

  select * from t3 order by val;
 val | val2 
-----+------
   5 |   11
   6 |   11
(2 rows)

  select * from p1 order by a;
  a  |  b  
-----+-----
  55 |  66
  77 |  88
 111 | 222
 123 | 345
(4 rows)

  select * from c1 order by a;
  a  |  b  |  d  |  e  
-----+-----+-----+-----
 111 | 222 | 333 | 444
 123 | 345 | 567 | 789
(2 rows)

prepare transaction 'pt_1';
select gid from pg_prepared_xacts where gid = 'pt_1';
 gid  
------
 pt_1
(1 row)

select is_prepared_on_node('pt_1', 1); -- false
 is_prepared_on_node 
---------------------
 f
(1 row)

commit prepared 'pt_1';
-- ****  
begin;
  insert into t3 values(7,11);
  insert into t3 values(8,11);
  insert into t3 values(9,11);
  insert into t3 values(0,11);
prepare transaction 'pt_1';
select gid from pg_prepared_xacts where gid = 'pt_1';
 gid  
------
 pt_1
(1 row)

select is_prepared_on_node('pt_1', 1); -- true
 is_prepared_on_node 
---------------------
 t
(1 row)

commit prepared 'pt_1';
select * from t3 order by val;
 val | val2 
-----+------
   0 |   11
   5 |   11
   6 |   11
   7 |   11
   8 |   11
   9 |   11
(6 rows)

-- ****  
begin;
  update t3 set val2 = 22;
prepare transaction 'pt_1';
select gid from pg_prepared_xacts where gid = 'pt_1';
 gid  
------
 pt_1
(1 row)

select is_prepared_on_node('pt_1', 1); -- true
 is_prepared_on_node 
---------------------
 t
(1 row)

commit prepared 'pt_1';
select * from t3 order by val;
 val | val2 
-----+------
   0 |   22
   5 |   22
   6 |   22
   7 |   22
   8 |   22
   9 |   22
(6 rows)

-- ****  
begin;
  delete from t3 where val = 0;
prepare transaction 'pt_1';
select gid from pg_prepared_xacts where gid = 'pt_1';
 gid  
------
 pt_1
(1 row)

select is_prepared_on_node('pt_1', 1); -- true
 is_prepared_on_node 
---------------------
 t
(1 row)

commit prepared 'pt_1';
select * from t3 order by val;
 val | val2 
-----+------
   5 |   22
   6 |   22
   7 |   22
   8 |   22
   9 |   22
(5 rows)

-- ****  
begin;
  WITH q1 AS (SELECT * from t1 order by 1) SELECT * FROM q1;
 val | val2 
-----+------
   1 |   11
   2 |   11
(2 rows)

prepare transaction 'pt_1';
select gid from pg_prepared_xacts where gid = 'pt_1';
 gid  
------
 pt_1
(1 row)

select is_prepared_on_node('pt_1', 1); -- false
 is_prepared_on_node 
---------------------
 f
(1 row)

commit prepared 'pt_1';
-- ****  
begin;
  
prepare transaction 'pt_1';
select gid from pg_prepared_xacts where gid = 'pt_1';
 gid  
------
 pt_1
(1 row)

select is_prepared_on_node('pt_1', 1); -- false
 is_prepared_on_node 
---------------------
 f
(1 row)

commit prepared 'pt_1';
-- ****  
begin;
  select * from t1, t2 where t1.val = t2.val;
 val | val2 | val | val2 
-----+------+-----+------
(0 rows)

prepare transaction 'pt_1';
select gid from pg_prepared_xacts where gid = 'pt_1';
 gid  
------
 pt_1
(1 row)

select is_prepared_on_node('pt_1', 1); -- false
 is_prepared_on_node 
---------------------
 f
(1 row)

commit prepared 'pt_1';
-- **********************************
-- repeat all tests with FQS disabled
-- **********************************
delete from t3;
-- ****  
begin;
  select * from t1 order by val;
 val | val2 
-----+------
   1 |   11
   2 |   11
(2 rows)

  select * from t2 order by val;
 val | val2 
-----+------
   3 |   11
   4 |   11
(2 rows)

  select * from t3 order by val;
 val | val2 
-----+------
(0 rows)

  select * from p1 order by a;
  a  |  b  
-----+-----
  55 |  66
  77 |  88
 111 | 222
 123 | 345
(4 rows)

  select * from c1 order by a;
  a  |  b  |  d  |  e  
-----+-----+-----+-----
 111 | 222 | 333 | 444
 123 | 345 | 567 | 789
(2 rows)

prepare transaction 'pt_1';
select gid from pg_prepared_xacts where gid = 'pt_1';
 gid  
------
 pt_1
(1 row)

select is_prepared_on_node('pt_1', 1); -- false
 is_prepared_on_node 
---------------------
 f
(1 row)

commit prepared 'pt_1';
-- ****  
begin;
  insert into t3 values(7,11);
  insert into t3 values(8,11);
  insert into t3 values(9,11);
  insert into t3 values(0,11);
prepare transaction 'pt_1';
select gid from pg_prepared_xacts where gid = 'pt_1';
 gid  
------
 pt_1
(1 row)

select is_prepared_on_node('pt_1', 1); -- true
 is_prepared_on_node 
---------------------
 t
(1 row)

commit prepared 'pt_1';
select * from t3 order by val;
 val | val2 
-----+------
   0 |   11
   7 |   11
   8 |   11
   9 |   11
(4 rows)

-- ****  
begin;
  update t3 set val2 = 22;
prepare transaction 'pt_1';
select gid from pg_prepared_xacts where gid = 'pt_1';
 gid  
------
 pt_1
(1 row)

select is_prepared_on_node('pt_1', 1); -- true
 is_prepared_on_node 
---------------------
 t
(1 row)

commit prepared 'pt_1';
select * from t3 order by val;
 val | val2 
-----+------
   0 |   22
   7 |   22
   8 |   22
   9 |   22
(4 rows)

-- ****  
begin;
  delete from t3 where val = 7;
prepare transaction 'pt_1';
select gid from pg_prepared_xacts where gid = 'pt_1';
 gid  
------
 pt_1
(1 row)

select is_prepared_on_node('pt_1', 1); -- true
 is_prepared_on_node 
---------------------
 t
(1 row)

commit prepared 'pt_1';
select * from t3 order by val;
 val | val2 
-----+------
   0 |   22
   8 |   22
   9 |   22
(3 rows)

-- ****  
begin;
  WITH q1 AS (SELECT * from t1 order by 1) SELECT * FROM q1;
 val | val2 
-----+------
   1 |   11
   2 |   11
(2 rows)

prepare transaction 'pt_1';
select gid from pg_prepared_xacts where gid = 'pt_1';
 gid  
------
 pt_1
(1 row)

select is_prepared_on_node('pt_1', 1); -- false
 is_prepared_on_node 
---------------------
 f
(1 row)

commit prepared 'pt_1';
-- ****  
begin;
  
prepare transaction 'pt_1';
select gid from pg_prepared_xacts where gid = 'pt_1';
 gid  
------
 pt_1
(1 row)

select is_prepared_on_node('pt_1', 1); -- false
 is_prepared_on_node 
---------------------
 f
(1 row)

commit prepared 'pt_1';
-- ****  
begin;
  select * from t1, t2 where t1.val = t2.val;
 val | val2 | val | val2 
-----+------+-----+------
(0 rows)

prepare transaction 'pt_1';
select gid from pg_prepared_xacts where gid = 'pt_1';
 gid  
------
 pt_1
(1 row)

select is_prepared_on_node('pt_1', 1); -- false
 is_prepared_on_node 
---------------------
 f
(1 row)

commit prepared 'pt_1';
-- ****  
-- drop objects created
drop table c1;
drop table p1;
drop table t1;
drop table t2;
drop table t3;
