--
-- XC_TRIGGER
--
-- Creation of a trigger-based method to improve run of count queries
-- by incrementation and decrementation of statement-based and row-based counters
-- Create tables
CREATE TABLE xc_trigger_rep_tab (a int, b int) DISTRIBUTE BY REPLICATION;
CREATE TABLE xc_trigger_hash_tab (a int, b int) DISTRIBUTE BY HASH(a);
CREATE TABLE xc_trigger_rr_tab (a int, b int) DISTRIBUTE BY ROUNDROBIN;
CREATE TABLE xc_trigger_modulo_tab (a int, b int) DISTRIBUTE BY MODULO(a);
CREATE TABLE table_stats (table_name text primary key,
num_insert_query int DEFAULT 0,
num_update_query int DEFAULT 0,
num_delete_query int DEFAULT 0,
num_truncate_query int DEFAULT 0,
num_insert_row int DEFAULT 0,
num_update_row int DEFAULT 0,
num_delete_row int DEFAULT 0);
NOTICE:  CREATE TABLE / PRIMARY KEY will create implicit index "table_stats_pkey" for table "table_stats"
-- Insert default entries
INSERT INTO table_stats (table_name) VALUES ('xc_trigger_rep_tab');
INSERT INTO table_stats (table_name) VALUES ('xc_trigger_hash_tab');
INSERT INTO table_stats (table_name) VALUES ('xc_trigger_rr_tab');
INSERT INTO table_stats (table_name) VALUES ('xc_trigger_modulo_tab');
-- Functions to manage stats of table
-- Count the number of queries run
CREATE FUNCTION count_insert_query() RETURNS TRIGGER AS $_$
	BEGIN
		UPDATE table_stats SET num_insert_query = num_insert_query + 1  WHERE table_name = TG_TABLE_NAME;
		RETURN NEW;
	END $_$ LANGUAGE 'plpgsql';
CREATE FUNCTION count_update_query() RETURNS TRIGGER AS $_$
	BEGIN
		UPDATE table_stats SET num_update_query = num_update_query + 1  WHERE table_name = TG_TABLE_NAME;
		RETURN OLD;
	END $_$ LANGUAGE 'plpgsql';
CREATE FUNCTION count_delete_query() RETURNS TRIGGER AS $_$
	BEGIN
		UPDATE table_stats SET num_delete_query = num_delete_query + 1  WHERE table_name = TG_TABLE_NAME;
		RETURN OLD;
	END $_$ LANGUAGE 'plpgsql';
CREATE FUNCTION count_truncate_query() RETURNS TRIGGER AS $_$
	BEGIN
		UPDATE table_stats SET num_truncate_query = num_truncate_query + 1  WHERE table_name = TG_TABLE_NAME;
		RETURN OLD;
	END $_$ LANGUAGE 'plpgsql';
-- Count the number of rows used
CREATE FUNCTION count_insert_row() RETURNS TRIGGER AS $_$
	BEGIN
		UPDATE table_stats SET num_insert_row = num_insert_row + 1  WHERE table_name = TG_TABLE_NAME;
		RETURN NEW;
	END $_$ LANGUAGE 'plpgsql';
CREATE FUNCTION count_update_row() RETURNS TRIGGER AS $_$
	BEGIN
		UPDATE table_stats SET num_update_row = num_update_row + 1  WHERE table_name = TG_TABLE_NAME;
		RETURN OLD;
	END $_$ LANGUAGE 'plpgsql';
CREATE FUNCTION count_delete_row() RETURNS TRIGGER AS $_$
	BEGIN
		UPDATE table_stats SET num_delete_row = num_delete_row + 1  WHERE table_name = TG_TABLE_NAME;
		RETURN OLD;
	END $_$ LANGUAGE 'plpgsql';
-- Define the events for each table
-- Replicated table
CREATE TRIGGER rep_count_insert_query AFTER INSERT ON xc_trigger_rep_tab
	FOR EACH STATEMENT EXECUTE PROCEDURE count_insert_query();
CREATE TRIGGER rep_count_update_query BEFORE UPDATE ON xc_trigger_rep_tab
	FOR EACH STATEMENT EXECUTE PROCEDURE count_update_query();
CREATE TRIGGER rep_count_delete_query BEFORE DELETE ON xc_trigger_rep_tab
	FOR EACH STATEMENT EXECUTE PROCEDURE count_delete_query();
CREATE TRIGGER rep_count_truncate_query BEFORE TRUNCATE ON xc_trigger_rep_tab
	FOR EACH STATEMENT EXECUTE PROCEDURE count_truncate_query();
CREATE TRIGGER rep_count_insert_row BEFORE INSERT ON xc_trigger_rep_tab
	FOR EACH ROW EXECUTE PROCEDURE count_insert_row();
ERROR:  Postgres-XC does not support ROW TRIGGER yet
DETAIL:  The feature is not currently supported
CREATE TRIGGER rep_count_update_row BEFORE UPDATE ON xc_trigger_rep_tab
	FOR EACH ROW EXECUTE PROCEDURE count_update_row();
ERROR:  Postgres-XC does not support ROW TRIGGER yet
DETAIL:  The feature is not currently supported
CREATE TRIGGER rep_count_delete_row BEFORE DELETE ON xc_trigger_rep_tab
	FOR EACH ROW EXECUTE PROCEDURE count_delete_row();
ERROR:  Postgres-XC does not support ROW TRIGGER yet
DETAIL:  The feature is not currently supported
-- Renaming of trigger based on a table
ALTER TRIGGER repcount_update_row ON my_table RENAME TO repcount_update_row2;
ERROR:  relation "my_table" does not exist
-- Hash table
CREATE TRIGGER hash_count_insert_query AFTER INSERT ON xc_trigger_hash_tab
	FOR EACH STATEMENT EXECUTE PROCEDURE count_insert_query();
CREATE TRIGGER hash_count_update_query BEFORE UPDATE ON xc_trigger_hash_tab
	FOR EACH STATEMENT EXECUTE PROCEDURE count_update_query();
CREATE TRIGGER hash_count_delete_query BEFORE DELETE ON xc_trigger_hash_tab
	FOR EACH STATEMENT EXECUTE PROCEDURE count_delete_query();
CREATE TRIGGER hash_count_truncate_query BEFORE TRUNCATE ON xc_trigger_hash_tab
	FOR EACH STATEMENT EXECUTE PROCEDURE count_truncate_query();
CREATE TRIGGER hash_count_insert_row BEFORE INSERT ON xc_trigger_hash_tab
	FOR EACH ROW EXECUTE PROCEDURE count_insert_row();
ERROR:  Postgres-XC does not support ROW TRIGGER yet
DETAIL:  The feature is not currently supported
CREATE TRIGGER hash_count_update_row BEFORE UPDATE ON xc_trigger_hash_tab
	FOR EACH ROW EXECUTE PROCEDURE count_update_row();
ERROR:  Postgres-XC does not support ROW TRIGGER yet
DETAIL:  The feature is not currently supported
CREATE TRIGGER hash_count_delete_row BEFORE DELETE ON xc_trigger_hash_tab
	FOR EACH ROW EXECUTE PROCEDURE count_delete_row();
ERROR:  Postgres-XC does not support ROW TRIGGER yet
DETAIL:  The feature is not currently supported
-- Round robin table
CREATE TRIGGER rr_count_insert_query AFTER INSERT ON xc_trigger_rr_tab
	FOR EACH STATEMENT EXECUTE PROCEDURE count_insert_query();
CREATE TRIGGER rr_count_update_query BEFORE UPDATE ON xc_trigger_rr_tab
	FOR EACH STATEMENT EXECUTE PROCEDURE count_update_query();
CREATE TRIGGER rr_count_delete_query BEFORE DELETE ON xc_trigger_rr_tab
	FOR EACH STATEMENT EXECUTE PROCEDURE count_delete_query();
CREATE TRIGGER rr_count_truncate_query BEFORE TRUNCATE ON xc_trigger_rr_tab
	FOR EACH STATEMENT EXECUTE PROCEDURE count_truncate_query();
CREATE TRIGGER rr_count_insert_row BEFORE INSERT ON xc_trigger_rr_tab
	FOR EACH ROW EXECUTE PROCEDURE count_insert_row();
ERROR:  Postgres-XC does not support ROW TRIGGER yet
DETAIL:  The feature is not currently supported
CREATE TRIGGER rr_count_update_row BEFORE UPDATE ON xc_trigger_rr_tab
	FOR EACH ROW EXECUTE PROCEDURE count_update_row();
ERROR:  Postgres-XC does not support ROW TRIGGER yet
DETAIL:  The feature is not currently supported
CREATE TRIGGER rr_count_delete_row BEFORE DELETE ON xc_trigger_rr_tab
	FOR EACH ROW EXECUTE PROCEDURE count_delete_row();
ERROR:  Postgres-XC does not support ROW TRIGGER yet
DETAIL:  The feature is not currently supported
-- Modulo table
CREATE TRIGGER modulo_count_insert_query AFTER INSERT ON xc_trigger_modulo_tab
	FOR EACH STATEMENT EXECUTE PROCEDURE count_insert_query();
CREATE TRIGGER modulo_count_update_query BEFORE UPDATE ON xc_trigger_modulo_tab
	FOR EACH STATEMENT EXECUTE PROCEDURE count_update_query();
CREATE TRIGGER modulo_count_delete_query BEFORE DELETE ON xc_trigger_modulo_tab
	FOR EACH STATEMENT EXECUTE PROCEDURE count_delete_query();
CREATE TRIGGER modulo_count_truncate_query BEFORE TRUNCATE ON xc_trigger_modulo_tab
	FOR EACH STATEMENT EXECUTE PROCEDURE count_truncate_query();
CREATE TRIGGER modulo_count_insert_row BEFORE INSERT ON xc_trigger_modulo_tab
	FOR EACH ROW EXECUTE PROCEDURE count_insert_row();
ERROR:  Postgres-XC does not support ROW TRIGGER yet
DETAIL:  The feature is not currently supported
CREATE TRIGGER modulo_count_update_row BEFORE UPDATE ON xc_trigger_modulo_tab
	FOR EACH ROW EXECUTE PROCEDURE count_update_row();
ERROR:  Postgres-XC does not support ROW TRIGGER yet
DETAIL:  The feature is not currently supported
CREATE TRIGGER modulo_count_delete_row BEFORE DELETE ON xc_trigger_modulo_tab
	FOR EACH ROW EXECUTE PROCEDURE count_delete_row();
ERROR:  Postgres-XC does not support ROW TRIGGER yet
DETAIL:  The feature is not currently supported
-- Insert some values to test the INSERT triggers
INSERT INTO xc_trigger_rep_tab VALUES (1,2);
INSERT INTO xc_trigger_rep_tab VALUES (3,4);
INSERT INTO xc_trigger_rep_tab VALUES (5,6),(7,8),(9,10);
INSERT INTO xc_trigger_hash_tab VALUES (1,2);
INSERT INTO xc_trigger_hash_tab VALUES (3,4);
INSERT INTO xc_trigger_hash_tab VALUES (5,6),(7,8),(9,10);
INSERT INTO xc_trigger_rr_tab VALUES (1,2);
INSERT INTO xc_trigger_rr_tab VALUES (3,4);
INSERT INTO xc_trigger_rr_tab VALUES (5,6),(7,8),(9,10);
INSERT INTO xc_trigger_modulo_tab VALUES (1,2);
INSERT INTO xc_trigger_modulo_tab VALUES (3,4);
INSERT INTO xc_trigger_modulo_tab VALUES (5,6),(7,8),(9,10);
SELECT * FROM table_stats ORDER BY table_name;
      table_name       | num_insert_query | num_update_query | num_delete_query | num_truncate_query | num_insert_row | num_update_row | num_delete_row 
-----------------------+------------------+------------------+------------------+--------------------+----------------+----------------+----------------
 xc_trigger_hash_tab   |                3 |                0 |                0 |                  0 |              0 |              0 |              0
 xc_trigger_modulo_tab |                3 |                0 |                0 |                  0 |              0 |              0 |              0
 xc_trigger_rep_tab    |                3 |                0 |                0 |                  0 |              0 |              0 |              0
 xc_trigger_rr_tab     |                3 |                0 |                0 |                  0 |              0 |              0 |              0
(4 rows)

-- Update some values to test the UPDATE triggers
UPDATE xc_trigger_rep_tab SET b = b+1 WHERE a = 1;
UPDATE xc_trigger_rep_tab SET b = b+1 WHERE a = 3;
UPDATE xc_trigger_rep_tab SET b = b+1 WHERE a IN (5,7,9);
UPDATE xc_trigger_hash_tab SET b = b+1 WHERE a = 1;
UPDATE xc_trigger_hash_tab SET b = b+1 WHERE a = 3;
UPDATE xc_trigger_hash_tab SET b = b+1 WHERE a IN (5,7,9);
UPDATE xc_trigger_rr_tab SET b = b+1 WHERE a = 1;
UPDATE xc_trigger_rr_tab SET b = b+1 WHERE a = 3;
UPDATE xc_trigger_rr_tab SET b = b+1 WHERE a IN (5,7,9);
UPDATE xc_trigger_modulo_tab SET b = b+1 WHERE a = 1;
UPDATE xc_trigger_modulo_tab SET b = b+1 WHERE a = 3;
UPDATE xc_trigger_modulo_tab SET b = b+1 WHERE a IN (5,7,9);
SELECT * FROM table_stats ORDER BY table_name;
      table_name       | num_insert_query | num_update_query | num_delete_query | num_truncate_query | num_insert_row | num_update_row | num_delete_row 
-----------------------+------------------+------------------+------------------+--------------------+----------------+----------------+----------------
 xc_trigger_hash_tab   |                3 |                3 |                0 |                  0 |              0 |              0 |              0
 xc_trigger_modulo_tab |                3 |                3 |                0 |                  0 |              0 |              0 |              0
 xc_trigger_rep_tab    |                3 |                3 |                0 |                  0 |              0 |              0 |              0
 xc_trigger_rr_tab     |                3 |                3 |                0 |                  0 |              0 |              0 |              0
(4 rows)

-- Delete some values to test the DELETE triggers
DELETE FROM xc_trigger_rep_tab WHERE a = 1;
DELETE FROM xc_trigger_rep_tab WHERE a = 3;
DELETE FROM xc_trigger_rep_tab WHERE a IN (5,7,9);
DELETE FROM xc_trigger_hash_tab WHERE a = 1;
DELETE FROM xc_trigger_hash_tab WHERE a = 3;
DELETE FROM xc_trigger_hash_tab WHERE a IN (5,7,9);
DELETE FROM xc_trigger_rr_tab WHERE a = 1;
DELETE FROM xc_trigger_rr_tab WHERE a = 3;
DELETE FROM xc_trigger_rr_tab WHERE a IN (5,7,9);
DELETE FROM xc_trigger_modulo_tab WHERE a = 1;
DELETE FROM xc_trigger_modulo_tab WHERE a = 3;
DELETE FROM xc_trigger_modulo_tab WHERE a IN (5,7,9);
SELECT * FROM table_stats ORDER BY table_name;
      table_name       | num_insert_query | num_update_query | num_delete_query | num_truncate_query | num_insert_row | num_update_row | num_delete_row 
-----------------------+------------------+------------------+------------------+--------------------+----------------+----------------+----------------
 xc_trigger_hash_tab   |                3 |                3 |                3 |                  0 |              0 |              0 |              0
 xc_trigger_modulo_tab |                3 |                3 |                3 |                  0 |              0 |              0 |              0
 xc_trigger_rep_tab    |                3 |                3 |                3 |                  0 |              0 |              0 |              0
 xc_trigger_rr_tab     |                3 |                3 |                3 |                  0 |              0 |              0 |              0
(4 rows)

-- Truncate the table to test the TRUNCATE triggers
TRUNCATE xc_trigger_rep_tab;
TRUNCATE xc_trigger_hash_tab;
TRUNCATE xc_trigger_rr_tab;
TRUNCATE xc_trigger_modulo_tab;
SELECT * FROM table_stats ORDER BY table_name;
      table_name       | num_insert_query | num_update_query | num_delete_query | num_truncate_query | num_insert_row | num_update_row | num_delete_row 
-----------------------+------------------+------------------+------------------+--------------------+----------------+----------------+----------------
 xc_trigger_hash_tab   |                3 |                3 |                3 |                  1 |              0 |              0 |              0
 xc_trigger_modulo_tab |                3 |                3 |                3 |                  1 |              0 |              0 |              0
 xc_trigger_rep_tab    |                3 |                3 |                3 |                  1 |              0 |              0 |              0
 xc_trigger_rr_tab     |                3 |                3 |                3 |                  1 |              0 |              0 |              0
(4 rows)

-- Clean up everything
DROP TABLE xc_trigger_rep_tab, xc_trigger_hash_tab, xc_trigger_rr_tab, xc_trigger_modulo_tab, table_stats;
DROP FUNCTION count_tuple_increment();
ERROR:  function count_tuple_increment() does not exist
DROP FUNCTION count_tuple_decrement();
ERROR:  function count_tuple_decrement() does not exist
DROP FUNCTION count_insert_query();
DROP FUNCTION count_update_query();
DROP FUNCTION count_delete_query();
DROP FUNCTION count_truncate_query();
DROP FUNCTION count_insert_row();
DROP FUNCTION count_update_row();
DROP FUNCTION count_delete_row();
-- Tests for INSTEAD OF
-- Replace operations on a view by operations on a table
CREATE TABLE real_table (a int, b int);
CREATE VIEW real_view AS SELECT a,b FROM real_table;
CREATE FUNCTION insert_real() RETURNS TRIGGER AS $_$
	BEGIN
		INSERT INTO real_table VALUES (NEW.a, NEW.b);
		RETURN NEW;
	END $_$ LANGUAGE 'plpgsql';
CREATE FUNCTION update_real() RETURNS TRIGGER AS $_$
	BEGIN
		UPDATE real_table SET a = NEW.a, b = NEW.b WHERE a = OLD.a AND b = OLD.b;
		RETURN NEW;
	END $_$ LANGUAGE 'plpgsql';
CREATE FUNCTION delete_real() RETURNS TRIGGER AS $_$
	BEGIN
		DELETE FROM real_table WHERE a = OLD.a AND b = OLD.b;
		RETURN OLD;
	END $_$ LANGUAGE 'plpgsql';
CREATE TRIGGER insert_real_trig INSTEAD OF INSERT ON real_view FOR EACH ROW EXECUTE PROCEDURE insert_real();
ERROR:  Postgres-XC does not support ROW TRIGGER yet
DETAIL:  The feature is not currently supported
CREATE TRIGGER update_real_trig INSTEAD OF UPDATE ON real_view FOR EACH ROW EXECUTE PROCEDURE update_real();
ERROR:  Postgres-XC does not support ROW TRIGGER yet
DETAIL:  The feature is not currently supported
CREATE TRIGGER delete_real_trig INSTEAD OF DELETE ON real_view FOR EACH ROW EXECUTE PROCEDURE delete_real();
ERROR:  Postgres-XC does not support ROW TRIGGER yet
DETAIL:  The feature is not currently supported
-- Renaming of trigger based on a view
ALTER TRIGGER delete_real_trig ON real_view RENAME TO delete_real_trig2;
ERROR:  trigger "delete_real_trig" for table "real_view" does not exist
-- Actions
INSERT INTO real_view VALUES(1,1);
ERROR:  cannot insert into view "real_view"
HINT:  You need an unconditional ON INSERT DO INSTEAD rule or an INSTEAD OF INSERT trigger.
SELECT * FROM real_table;
 a | b 
---+---
(0 rows)

UPDATE real_view SET b = 4 WHERE a = 1;
ERROR:  cannot update view "real_view"
HINT:  You need an unconditional ON UPDATE DO INSTEAD rule or an INSTEAD OF UPDATE trigger.
SELECT * FROM real_table;
 a | b 
---+---
(0 rows)

DELETE FROM real_view WHERE a = 1;
ERROR:  cannot delete from view "real_view"
HINT:  You need an unconditional ON DELETE DO INSTEAD rule or an INSTEAD OF DELETE trigger.
SELECT * FROM real_table;
 a | b 
---+---
(0 rows)

-- Clean up
DROP VIEW real_view CASCADE;
DROP FUNCTION insert_real() cascade;
DROP FUNCTION update_real() cascade;
DROP FUNCTION delete_real() cascade;
DROP TABLE real_table;
